{
    "id": "75da686f-4d37-48cb-8755-80121ebf3647",
    "name": "BenState",
    "managerId": "7fb2c8d6-c83f-412e-8e18-0e87ed3befcc",
    "managerName": "Sergei",
    "markdown": "Here is some markdown _stuff_.",
    "audience": "gameboard",
    "launchpointUrl": "https://google.com",
    "players": [
        {
            "gamespaceId": "33b9cf31-8686-4d95-b5a8-9fb1b7f8ce71",
            "subjectId": "f4390dff-420d-47da-90c8-4c982eeab822",
            "subjectName": "A cool player",
            "permission": "None",
            "isManager": true
        }
    ],
    "whenCreated": "2023-02-24T14:37:17.303135-05:00",
    "startTime": "2023-02-24T14:37:17.319478-05:00",
    "endTime": "2023-02-24T15:37:17.319492-05:00",
    "expirationTime": "2023-02-24T15:37:17.319507-05:00",
    "isActive": true,
    "vms": [
        {
            "id": "10fccb66-6916-45e2-9a39-188d3a692d4a",
            "name": "VM 1",
            "isolationId": "vm1",
            "isRunning": true,
            "isVisible": true
        },
        {
            "id": "8d771689-8b37-48e7-b706-9efe1c64bdca",
            "name": "VM 2",
            "isolationId": "vm2",
            "isRunning": true,
            "isVisible": false
        }
    ],
    "challenge": {
        "text": "A challenging challenge",
        "maxPoints": 100,
        "maxAttempts": 3,
        "attempts": 1,
        "score": 50,
        "sectionCount": 1,
        "sectionIndex": 0,
        "sectionScore": 50,
        "sectionText": "The best one",
        "lastScoreTime": "2023-02-24T14:42:17.319688-05:00",
        "questions": [
            {
                "text": "What is your quest?",
                "hint": "It\u0027s not about swallows or whatever",
                "answer": "swallows",
                "example": "To be the very best, like no one ever was",
                "weight": 0.5,
                "penalty": 0.2,
                "isCorrect": false,
                "isGraded": true
            }
        ]
    }
}
